<?xml version="1.0" encoding="UTF-8"?>

<config
    xmlns:xsi='http://www.w3.org/2001/XMLSchema-instance'
    xsi:noNamespaceSchemaLocation='config.xsd'>
    <layoutbackbone>Player</layoutbackbone>
	<layoutAxis_X>ObjectPosition_X</layoutAxis_X>
	<layoutAxis_Y>ObjectPosition_Y</layoutAxis_Y>
	<imageLocation>/images/BusMap.png</imageLocation>
	<imageOffset_X>-43.2206256</imageOffset_X>
	<imageOffset_Y>-22.9072658</imageOffset_Y>
	<coordinatesLayoutPosition>-0.0586224</coordinatesLayoutPosition>
	
	<temporalLayoutscale>-10000000.5</temporalLayoutscale>
	<showentitydate>false</showentitydate>
    <edgetype>
        <edge>Cronological</edge>
        <edgestroke>MAX</edgestroke>
        <collapsefunction>SUM</collapsefunction>
    </edgetype>
    <colorscheme>
        <attribute>VELOCIDADE</attribute>
        <class>ActivityScheme</class>
        <values></values>
        <goodvalue></goodvalue>
        <badvalue></badvalue>
    </colorscheme>	
    <activitycolor>
        <attribute>LINHA</attribute>
        <value>47</value>
        <vercolor>
            <r>255</r>
            <g>180</g>
            <b>180</b>
        </vercolor>
    </activitycolor>
</config>