<?xml version="1.0" encoding="UTF-8"?>
<!--
To change this template, choose Tools | Templates
and open the template in the editor.
-->


<config
    xmlns:xsi='http://www.w3.org/2001/XMLSchema-instance'
    xsi:noNamespaceSchemaLocation='config.xsd'>
    <default_layout>ISOMLayout</default_layout>
    <vertexSize>15</vertexSize>
    <layoutAxis_X>ObjectPosition_X</layoutAxis_X>
    <layoutAxis_Y>ObjectPosition_Y</layoutAxis_Y>
    <imageLocation></imageLocation>
    <imageOffset_X>0</imageOffset_X>
    <imageOffset_Y>0</imageOffset_Y>
    <spatialLayoutPosition>0.0</spatialLayoutPosition>
    <zoomLevel>0</zoomLevel>
    <temporalLayoutscale>1.0</temporalLayoutscale>
    <temporalLayoutbackbone></temporalLayoutbackbone>
    <edgetype>
        <edge>wasDerivedFrom</edge>
        <edgestroke>MAX</edgestroke>
        <collapsefunction>SUM</collapsefunction>
    </edgetype>
    <edgetype>
        <edge>used</edge>
        <edgestroke>MAX</edgestroke>
        <collapsefunction>SUM</collapsefunction>
    </edgetype>
    <edgetype>
        <edge>wasGeneratedBy</edge>
        <edgestroke>MAX</edgestroke>
        <collapsefunction>SUM</collapsefunction>
    </edgetype>
    <edgetype>
        <edge>wasInformedBy</edge>
        <edgestroke>MAX</edgestroke>
        <collapsefunction>SUM</collapsefunction>
    </edgetype>
    <edgetype>
        <edge>wasAttributedTo</edge>
        <edgestroke>MAX</edgestroke>
        <collapsefunction>SUM</collapsefunction>
    </edgetype>
    <edgetype>
        <edge>wasAssociatedWith</edge>
        <edgestroke>MAX</edgestroke>
        <collapsefunction>SUM</collapsefunction>
    </edgetype>
    <edgetype>
        <edge>actedOnBehalfOf</edge>
        <edgestroke>MAX</edgestroke>
        <collapsefunction>SUM</collapsefunction>
    </edgetype>
	<edgetype>
        <edge>Chronological</edge>
        <edgestroke>MAX</edgestroke>
        <collapsefunction>SUM</collapsefunction>
    </edgetype>
	
	<colorscheme>
        <attribute>A</attribute>
        <class>ActivityScheme</class>
		<trafficLightType>type2</trafficLightType>
		<isInverted>false</isInverted>
        <values></values>
        <goodvalue></goodvalue>
        <badvalue></badvalue>
    </colorscheme>
	<colorscheme>
        <attribute>Cluster</attribute>
        <class>ActivityScheme</class>
		<trafficLightType>type1</trafficLightType>
		<isInverted>false</isInverted>
        <values></values>
        <goodvalue></goodvalue>
        <badvalue></badvalue>
    </colorscheme>
	<!-- <vertexstroke>
        <attribute>isOracle</attribute>
        <values>true</values>
    </vertexstroke>
	-->
	<activitycolor>
        <attribute>isOracle</attribute>
        <value>true</value>
        <vercolor>
            <r>238</r>
            <g>180</g>
            <b>180</b>
        </vercolor>
    </activitycolor>
</config>
