<?xml version="1.0" encoding="UTF-8"?>

<config
    xmlns:xsi='http://www.w3.org/2001/XMLSchema-instance'
    xsi:noNamespaceSchemaLocation='config.xsd'>
    <vertexSize>30</vertexSize>
    <default_layout>SpatialLayout</default_layout>
    <layoutAxis_X>ObjectPosition_X</layoutAxis_X>
    <layoutAxis_Y>ObjectPosition_Y</layoutAxis_Y>
    <imageLocation></imageLocation>
    <imageOffset_X>0</imageOffset_X>
    <imageOffset_Y>0</imageOffset_Y>
    <spatialLayoutPosition>0.0</spatialLayoutPosition>
    <zoomLevel>0</zoomLevel>
    <temporalLayoutbackbone>Player</temporalLayoutbackbone>
    <temporalLayoutscale>1.0</temporalLayoutscale>
    <edgetype>
        <edge>wasInfluencedBy</edge>
        <edgestroke>MAX</edgestroke>
        <collapsefunction>SUM</collapsefunction>
    </edgetype>
    <edgetype>
        <edge>wasGeneratedBy</edge>
        <edgestroke>MAX</edgestroke>
        <collapsefunction>SUM</collapsefunction>
    </edgetype>
    <edgetype>
        <edge>used</edge>
        <edgestroke>MAX</edgestroke>
        <collapsefunction>SUM</collapsefunction>
    </edgetype>
	<edgetype>
        <edge>wasAssociatedWith</edge>
        <edgestroke>MAX</edgestroke>
        <collapsefunction>SUM</collapsefunction>
    </edgetype>
	<edgetype>
        <edge>Bugs</edge>
        <edgestroke>MAX</edgestroke>
        <collapsefunction>SUM</collapsefunction>
    </edgetype>
    <colorscheme>
        <attribute>Bugs</attribute>
        <class>EntityScheme</class>
        <values></values>
        <goodvalue></goodvalue>
        <badvalue></badvalue>
        <isInverted>true</isInverted>
    </colorscheme>
    <colorscheme>
        <attribute>Duration</attribute>
        <class>ActivityScheme</class>
        <values></values>
        <goodvalue></goodvalue>
        <badvalue></badvalue>
        <isInverted>true</isInverted>
    </colorscheme>
	<colorscheme>
        <attribute>Graph_01</attribute>
        <class>GraphVisualizationScheme</class>
        <values></values>
        <goodvalue></goodvalue>
        <badvalue></badvalue>
    </colorscheme>
    <colorscheme>
        <attribute>Graph_02</attribute>
        <class>GraphVisualizationScheme</class>
        <values></values>
        <goodvalue></goodvalue>
        <badvalue></badvalue>
    </colorscheme>
</config>

