<?xml version="1.0" encoding="UTF-8"?>

<config
    xmlns:xsi='http://www.w3.org/2001/XMLSchema-instance'
    xsi:noNamespaceSchemaLocation='config.xsd'>
    <default_layout>SpatialLayout</default_layout>
    <layoutAxis_X>ObjectPosition_X</layoutAxis_X>
    <layoutAxis_Y>ObjectPosition_Y</layoutAxis_Y>
    <imageLocation></imageLocation>
    <imageOffset_X>0</imageOffset_X>
    <imageOffset_Y>0</imageOffset_Y>
    <spatialLayoutPosition>0.0</spatialLayoutPosition>
    <zoomLevel>0</zoomLevel>
    <temporalLayoutbackbone>Player</temporalLayoutbackbone>
    <temporalLayoutscale>1.0</temporalLayoutscale>
    <edgetype>
        <edge>Chronological</edge>
        <edgestroke>MAX</edgestroke>
        <collapsefunction>SUM</collapsefunction>
    </edgetype>
    <edgetype>
        <edge>Neutral</edge>
        <edgestroke>MAX</edgestroke>
        <collapsefunction>SUM</collapsefunction>
    </edgetype>
    <edgetype>
        <edge>Association</edge>
        <edgestroke>MEAN</edgestroke>
        <collapsefunction>SUM</collapsefunction>
    </edgetype>
    <edgetype>
        <edge>Health</edge>
        <edgestroke>MEAN</edgestroke>
        <collapsefunction>SUM</collapsefunction>
    </edgetype>
    <colorscheme>
        <attribute>Health</attribute>
        <class>EntityScheme</class>
        <values></values>
        <goodvalue>100</goodvalue>
        <badvalue>0</badvalue>
    </colorscheme>
    <colorscheme>
        <attribute>Time</attribute>
        <class>ActivityScheme</class>
        <values></values>
        <goodvalue></goodvalue>
        <badvalue></badvalue>
    </colorscheme>
    <colorscheme>
        <attribute>Graph_01</attribute>
        <class>GraphVisualizationScheme</class>
        <values></values>
        <goodvalue></goodvalue>
        <badvalue></badvalue>
    </colorscheme>
    <colorscheme>
        <attribute>Graph_02</attribute>
        <class>GraphVisualizationScheme</class>
        <values></values>
        <goodvalue></goodvalue>
        <badvalue></badvalue>
    </colorscheme>
</config>

